book1,book2,start_ms1,start_ms2,start1,start2,end_ms1,end_ms2,end1,end2,text1,text2
0630IbnAthirCizzDin.Kamil,0421Miskawayh.Tajarib,1543,522,1494,1298,1544,523,306,655, خبره علي الحجاج فاشفق عليms1543 الجند فامر الناس بالدعاء لهم في المساجد وهم يقتتلون كل يوم وكان لقتيبة عين من العجم يقال له تندر فاعطاه اهل بخاري مالا ليرد عنهم قتيبة فاتاه فقال له سرا من الناس ان الحجاج قد عزل وقد اتي عامل الي خارسان فلو رجعت بالناس كان اصلح فامر به فقتل خوفا من ان يظهر الخبر فيهلك الناس ثم امر اصحابه بالجد في القتال فقاتلهم قتالا شديدا فانهزم, فاشفق علي الجند وامر الناس بالدعاء لهم في المساجد وهم يقتتلون في كل يوم وكان لقتيبة عين يقال له تندر من العجم فاعطاه اهل بخاري مالا علي ان يفتا عنهم قتيبة ذكر حيلة لتندر ما نفذت له وقتل لاجلها اقبل تندر الي قتيبة فقال اخلني فنهض الناس واحتبس قتيبة ضرار بن حصين الضبي فقال تندر هذا عامل يقدم عليكms0522 وقد عزل الحجاج فلو انصرفت بالناس الي مرو فدعا قتيبة مولاه سيا فقال له اضرب عنق تندر فقتله ثم قال لضرار لم يعلم هذا الخبر غيري وغيرك واني اعطي الله عهدا ان ظهر هذا الحديث من احد حتي تنقضي حربنا لالحقنك بتندر فاملك لسانك فان انتشار هذا الحديث يفت في اعضاد الناس ثم اذن للناس فدخلوا فراعهم قتل تندر فوجموا واطرقوا فقال قتيبة ما يردعكم من قتل عبد احانه الله قالوا كنا نظنه ناصحا للمسلمين قال بل كان غاشا قد مضي لسبيله بذنبه فاغدوا علي قتال عدوكم والقوهم بغير ما كنتم تلقونهم به فغدا الناس متاهبين فاخذوا مصافهم ومشي قتيبة فحض اهل الرايات فكانت بين الناس مشاولة ثم انهم تزاحفوا والتقوا واخذت السيوف ماخذها فقاتلوهم حتي زالت الشمس ثم منح الله المسلمين اكتافهم فانهزم المشركون يريدون المدينة
0630IbnAthirCizzDin.Kamil,0421Miskawayh.Tajarib,1589,541,1541,1320,1590,542,175,70, وامسك بيده وقيل كان في الكتاب الثالث لءن لم تقرنيms1589 علي ما كنت عليه وتءمنني لاخلعنك ولاملانها عليك رجالا وخيلا ثم امر سليمان برسول قتيبة فانزل ثم احضره ليلا فاعطاه دنانير جاءزته واعطاه عهد قتيبة علي خراسان وسير معه رسولا بذلك فلما كانا بحلوان بلغهما خلع, ثم امسكه بيده ثم امر رسول قتيبة ان ينزل فحول الي دار الضيافة فلما امسي دعا به سليمان فاعطاه صرة فيها دنانير فقال هذه جاءزتك وهذا عهد صاحبك علي خراسان فسر وهذا رسولي معك بعهده فخرج الباهلي و معه رسول سليمان فلما كانا بحلوان تلقاهما الناس بخلع قتيبة واضطراب الامر فدفع الرسول العهدms0541 الي رسول قتيبة وانصرف هو ذكر عجلة قتيبة بالخلع وما دبره من امره فاما قتيبة فانه لما هم بالخلع استشار
0630IbnAthirCizzDin.Kamil,0421Miskawayh.Tajarib,1605,556,493,542,1605,556,1014,747, ذلك مدينة ورجع الي خراسان واستعمل علي جرجان جهم بن زحر الجعفي وقيل بل قال يزيد لاصحابه لما ساروا اذا وصلتم الي الحصن انتظروا فاذا كان السحر كبروا واقصدوا الباب فستجدونني قد نهضت بالناس اليه فلما دخل ابن زحر امهل حتي كانت الساعة التي امره يزيد ان ينهض فيها فكبر ففزع اهل الحصن وكان اصحاب لا يلقون احدا الا قتلوه ودهش الترك فبقوا لا يدرون اين يتوجهون وسمع يزيد التكبير فسار في الناس الي الباب فلم يجد عند ه احد يمنع وهم مشغولون بالمسلمين فدخل الحصن من ساعته واخرج من فيه وصلبهم فرسخين عن يمين الطريق ويساره فصلهم اربعة فراسخ وسبي اهلها وغنم ما فيها وكتب الي سليمان بالفتح يعظمه, مدينة وكتب بذلك الي سليمان بن عبد العزيز بالفتح وعظم ذلك قال ان الله فتح لامير المءمنين من جرجان وطبرستان ما اعيا سابور ذا الاكتاف وكسري بن قباذ وكسري بن هرمز واعيا الفاروق عمر بن الخطاب وعثمان بن عفان ومن بعدهما من خلفاء الله وكتب في الكتاب ان قد صار عندي من
0630IbnAthirCizzDin.Kamil,0421Miskawayh.Tajarib,1637,573,439,730,1637,573,717,797, مسلمة فعبء جنود اهل الشام ثم قرب من ابن المهلب وجعل علي ميمنته جبلة بن مخرمة الكندي وعلي ميسرته الهذيل بن زفر بن الحرث الكلابي وجعل العباس بن الوليد علي ميمنته سيف بن هانء الهمداني وعلي ميسرته سويد بن القعقاع التميمي وكان مسلمة علي الناس وخرج يزيد بن المهلب وقد جعل علي ميمنته حبيب بن المهلب وعلي ميسرته المفضل بن المهلب فخرج رحل من, مسلمة فعبي جنود اهل الشام ميمنة وميسرة وازدلف بهم نحو يزيد وخرج اليه يزيد في مثل تعبءته فحدث العلاء بن منهال ان رجلا من
0630IbnAthirCizzDin.Kamil,0421Miskawayh.Tajarib,1639,576,1584,484,1640,576,22,519, بالبصرة فاعدوا السفن وتجهزواms1639 للركوب في البحر وكان يزيد بن المهلب بعث وداع بن, البحرية وتجهزوا بكل الجهاز لانهم كانوا يتخوفون ما كان وقد كان يزيد بن المهلب بعث وداع بن
0630IbnAthirCizzDin.Kamil,0421Miskawayh.Tajarib,1639,575,1584,1553,1640,576,22,519, بالبصرة فاعدوا السفن وتجهزواms1639 للركوب في البحر وكان يزيد بن المهلب بعث وداع بن, ومالك وعبد الملك ابنا مسمعms0575 وغيرهم من الاشراف وكانوا قالوا له ويحك انا لا نراك تقتلنا الا ان اباك قد قتل وان قتلنا ليس بنافعك في الدنيا وهو والله ضارك في الاخرة فقتلهم كلهم الا ربيع بن زياد بن ربيع بن انس فقال له قوم نسيته فقال ما نسيته ولكن لم اكن لاقتله وهو شيخ من قومي له شرف ومعروف ولست اتهمه في ود ولا اخاف بغيه ورثي الشعراء يزيد واخوته المقتولين فاكثروا واقبل معاوية بن يزيد حتي اتي البصرة معه المال والخزاءن وجاء المفضل فاجتمع اليه جميع ال المهلب بالبصرة وقد كانوا اعدوا السفن البحرية وتجهزوا بكل الجهاز لانهم كانوا يتخوفون ما كان وقد كان يزيد بن المهلب بعث وداع بن
0630IbnAthirCizzDin.Kamil,0421Miskawayh.Tajarib,1674,599,1552,1274,1675,600,40,929, تعصب حتي افسد الناس وضربms1674 نصر بن سيار ونفرا معه بالسياط منهم عبد الرحمن بن نعيم وسورة بن الحر, تعصب حتي افسد الناس وخطب في يوم جمعة فقال في خطبته قبح الله هذه الوجوه وجوه اهل الشقاق والنفاق والشغب والفساد اللهم فرق بيني وبينهم واخرجني الي مهاجري ووطني ثم قال من يروم ما قبلي او يترمرم وامير المءمنين خالي وخالد بن عبد الله اخي ومعي اثنا عشر الف سيف يمان ثمms0599 نزل عن منبره فلما صلي ودخل عليه الناس واخذوا مجالسهم اخرج كتابا من تحت فراشه فقراه علي الناس فيه ذكر نصر بن سيار وعبد الرحمن بن نعيم وسورة بن ابجر والبختري بن ابي درهم من بني الحارث بن عباد فدعا بهم وانبهم فارم القوم وتكلم سورة بن ابجر فذكر حاله وطاعته ومناصحته وانه ليس ينبغي له ان يقبل قول عدو مبطل وان يجمع بينهم وبين من فوقهم بالباطل فلم يقبل قوله وامر بهم فجردوا فضرب عبد الرحمن بن النعيم وكان رجلا بطينا ارسح فلما ضرب التوي وجعل سراويله يزل عن موضعه فقام بعض اهل بيته فاخذ رداء له هرويا وقام مادا ثوبه بيديه وهو ينظر الي اسد يريد ان ياذن له فيءزره فاوما اليه ان افعل فدنا منه فازره وقال اصبر ابا زهير فان الامير وال مءدب ثم ضرب الجميع وحلقهم بعد الضرب ودفعهم الي عبد ربه بن ابي صالح مولي بني سليم وكان من الحرسي وعيسي بن بريق ثم وجههم الي خالد وكتب اليه انهم ارادوا الوثوب عليه فكان ابن بريق كلما نبت شعر احدهم حلقه وكان البختري بن ابي درهم يقول وددت انه ضربني وهذا شهرا يعني نصر بن سيار لما كان بينهم بالبروقان فارسل بنو تميم الي نصر ان شءتم انتزعناكم
0630IbnAthirCizzDin.Kamil,0421Miskawayh.Tajarib,1690,617,1568,1588,1691,618,13,111, فقال له خالد بن عبيد الله سر واسرع فقال له المجشر انزل واخذms1690 بلجام دابته فنزل ونزل الناس معه فلم يستتم, والجنيد يتقدم فلما راي المجشرms0617 ذلك نزل فاخذ بلجام دابة الجنيد فقال والله لا تسير ولتنزلن طاءعا او كارها ولا ندعك تهلكنا بقول هذا الهجري انزل فنزل ونزل الناس فلم يتتام نزولهم
0630IbnAthirCizzDin.Kamil,0421Miskawayh.Tajarib,1699,621,1389,1352,1700,622,343,542, الممدوحين غير محمود في حروبه ذكر خلع الحرث بن سريج بخراسان وفي هذه السنة خلع الحرث بن سريج واقبل الي الفارياب فارسل اليه عاصم بن عبد الله رسلا فيهم مقاتل بن حيان النبطي وخطاب بن محرز السلمي فقالا لمن معهما لا نلقي الحرثms1699 الا بامان فابي القوم عليهما فاخذهم الحرث وحبسهم ووكل بهم رجلا يحفظهم فاوثقوه وخرجوا من السجن فركبوا وعادوا الي عاصم فامرهم فخطبوا وذموا الحرث وذكروا خبث سيرته وغدره وكان الحرث قد لبس السواد ودعا الي كتاب الله وسنة نبيه والبيعة للرضا فسار من الفارياب فاتي بلخ وعليها نصر بن سيار التجيبي فلقي الحرث وهو في عشرة الاف والحرث في اربعة الاف فقاتله فانهزم اهل بلخ وتبعهم الحرث, وانما قال ذلك لان الجنيد كان قد استسقي بطنه فمات الجنيد قبل وصول عاصم فقال ابو الجويرية هلك الجود والجنيد جميعا فعلي الجود والجنيد السلام اصبحا ثاويين في بطن مرو ما تغني علي الغصون الحمام كنتما نهزة الكرام فلما مت مات الندي وماتms0621 الكرام وفي هذه السنة خلع الحارث بن سريج وكانت الحرب بينه وبين عاصم بن عبد الله وذلك ان عاصما لما قدم خراسان اقبل الحارث بن سريج حتي قدم بلخ وعليها نصر بن سيار والبختي بن ضبيعة المري ولاهما الجنيد فلما انتهي الي قنطرة عطاء وهي علي نهر بلخ علي فرسخين من المدينة تلقاه نصر بن سيار في عشرة الاف والحارث بن سريج في اربعة الاف فدعاهما الحارث الي الكتاب والسنة والبيعة للرضا فقال قطن بن عبد الرحمن بن حر الباهلي يا حارث انت تدعو الي كتاب الله والسنة والله لو ان جبرءيل عن يمينك وميكاءيل عن يسارك ما اجبتك وقاتلهم فاصابته رمية في عينه فكان اول قتيل وانهزم الي المدينة اهل بلخ
0630IbnAthirCizzDin.Kamil,0421Miskawayh.Tajarib,1701,624,1546,407,1702,624,204,598, خراسان ر تصلح الا ان تضمms1701 الي العراق وتكون موادها ومعونتها من قريب لتباعد امير المءمنين وتباطء غياثه عنها فضم هشام خراسان الي خالد بن عبد الله القسري وكتب اليه ابعث اخاك يصلح ما افسد فان كان سببه كانت به فسير خالد اليها اخاه اسد فلما بلغ عاصما اقبال اسد وانه, لتباعد امير المءمنين عنها وتباطء غياثه عمن يكون بها فلما امضي كتابه اخرج حديثه الي اصحابه مثل مجشر بن مزاحم ويحيي بن حصين واشباههم فقال لهم المجشر بعد ما مضي الكتاب كانك باسد قد طلع عليك فقدم اسد بعد كتاب عاصم بشهرين ثم عاد الحارث واستعد واراد
0630IbnAthirCizzDin.Kamil,0421Miskawayh.Tajarib,1713,634,1547,692,1714,634,51,788, اربعة الاف وارجو ان يكونms1713 خاقان عقيرة الله فصف اسد اصحابه وعبء خاقان اصحابه فلما التقوا حمل الحرث ومن معه, وارجو ان يكون عقيرة الله وسار اسد علي تعبءة ميمنة وميسرة وقلبا وعبي خاقان مثل ذلك وجعل علي ميمنته الحارث بن سريج واصحابه وملك السغد وصاحب الشاش وصاحب الختل
0630IbnAthirCizzDin.Kamil,0421Miskawayh.Tajarib,1718,640,1599,316,1719,640,165,898, الجزيرة جندا من الجزيرة ووجهms1718 هشام جندا من الشام واجتمعوا بدير بين الجزيرة والموصل واقبل بهلول اليهم وقيل التقوا بكحيل دون الموصل فنزل بهلول علي باب الدير وهو في سبعين وحمل عليهم فقتل منهم نفرا وقاتلهم عامة نهاره وكانوا عشرين, الجزيرة جندا من الجزيرة ووجه اليه هشام جندا من الشام فاجتمعوا بدير بين الجزيرة والموصل واقبل بهلول حتي انتهي اليهم فنزل علي باب الدير فقالوا له تزحزح عن باب الدير حتي نخرج اليك فتنحي وخرجوا فلما راي كثرتهم وهو في سبعين جعل من اصحابه ميمنة وميسرة ثم اقبل علي اعداءه فقال اكلكم يرجو ان يقتلنا ويسلم فياتي اهله سالما قالوا نعم انا نرجو ذلك ان شاء الله فشد علي رجل عظيم من عظماءهم فقتله وقال اما هذا فلا ياتي اهله ابدا ولم يزل هذا ديدنه حتي قتل ستة فانهزموا ودخلوا الدير وحاصرهم حتي جاءتهم الامداد وكانوا عشرين الفا فقال له اصحابه الا نعقر دوابنا ثم نشد عليهم شدة واحدة فقال لا حتي نبلي عذرا ما استمسكنا علي دوابنا فقاتلوهم عامة نهارهم حتي فشا
0630IbnAthirCizzDin.Kamil,0421Miskawayh.Tajarib,1784,695,849,727,1784,696,874,994, فاخبره فلم يزل يرسل اليه مرة بعد اخري فكان اخر ما قاله له الكرماني اني لا امن, الي نصر فاخبره قال عد اليه قال لا وما بي هيبة له ولكن اكره ان يسمعني فيك ما اكره فبعث اليه عصمة بن عبد الله الاسدي فقال يا با علي اني اخاف عليك خصالا فانطلق الي اميرك يعرضها عليك وما يريد بذلك الا الاعذار اليك فقال الكرماني اني اعلم ان نصرا لم يقل هذا لك ولكنك اردت ان يبلغه فتحظي والله لا اكلمك كلمة بعد انقضاء كلامي حتي ترجع الي اميرك فيرسل من احب غيرك فرجع عصمة فقال ما رايت علجا اعدي لطوره من الكرماني وما اعجب منه ولكني اعجب من يحيي بن حصين واصحابه لعنهم الله والله لهم اشد تعظيما له من اصحابه فقال سلم بن احوز لنصر اني اخاف فساد هذا الثغر والناس فارسل اليه قديدا فقال نصر لقديد بن منيع انطلق اليه فاتاه فقال يا با علي قد لحجت واخاف ان يتفاقم الامر فنهلك جميعا وتشمت بنا هذه الاعاجم قال يا قديد اني لا اتهمك وقد جاء من لا اثق معه بنصر وقد قال رسول الله صليms0695 الله عليه البكري اخوك ولا تثق به قال اما وقد وقع هذا في نفسك فاعطه رهنا قال اعطيه عليا وعثمان فمن يعطيني ولا خير فيه فقال يا با علي نشدتك الله ان يكون خراب هذه البلدة علي يديك ورجع الي نصر فقال نصر لعقيل بن معقل الليثي ما اخوفني ان يقع بهذا الثغر بلاء فكلم ابن عمك فقال عقيل لنصر ايها الامير انشدك الله ان تشام عشيرتك ان مروان بالشام تقاتله الخوارج والناس في فتنة والازد اخفاء سفهاء وهم جيرانك قال فما اصنع ان علمت امرا يصلح الناس فدونك وقد زعم انه لا يثق بي قال فاتي عقيل الكرماني فقال يا با علي قد سننت للسفهاء سنة تطلب بعدك من الامراء اني اري امرا اخاف ان تذهب فيه العقول قال الكرماني ان نصرا يريد ان اتيه ولا امنه واريد ان يعتزل ونعتزل و نختار رجلا من بكر بن واءل نرضاه جميعا فيلي امرنا حتي ياتي امر الخليفة وهو يابي هذا قال يا با علي اني اخاف ان يهلك اهل هذا الثغر فات اميرك وقل ما شءت تجب اليه ولا تطمع سفهاء قومك فيما دخلوا فيه فقال الكرماني اني لا اتهمك في نصيحة ولا عقل ولكني لا اثق بنصر فليحمل من المال ما شاء وليشخص قال فهل لك في امر يجمع الامر بينكما تتزوج اليه ويتزوج اليك قال لا امنه علي حال قال ما بعد هذا
0630IbnAthirCizzDin.Kamil,0421Miskawayh.Tajarib,1784,697,1484,346,1785,697,359,730, ليردوه من بلاد الترك وسارms1784 خالد بن زياد الترمذي وخالد بن عمرو مولي بني عامر الي يزيد بن الوليد فاخذا للحرث منه امانا فكتب له امانه وامر نصر ان يرد عليه ما اخذ له وامر عبد الله بن عمر بن عبد العزيز عامل الكوفة بذلك ايضا فاخذا الامان وسار الي الكوفة ثم الي خراسان فارسل نصر اليه فلقيه الرسول وقد رجع مع مقاتل بن حيان واصحابه فوصل الي نصر وقال بمرو الروذ ورد نصر عليه ما اخذ له وكان عوده سنة سبع وعشرين وماءة ذكر شيعة, منه امانا للحارث بن سريج فكتب له امانا ولمن معه وامر نصرا برد ما كان اخذ له ولاصحابه ثم نفذ القوم الي الحارث فلقوا مقاتل بن حيان واصحابه الذين وجههم نصر الي الحارث واقبل الحارث يريد مرو وكان مقامه بارض الترك اثنتي عشرة سنة فيقال ان نصرا كتب الي الحراث من غير اذن الخليفة فكتب اليه ابن عمر انك امنت الحارث بغير اذني ولا اذن الخليفة فسقط في يديه فبعث يزيد بن الاحمر وامره ان يفتك بالحارث اذا صار معه في السفينة وفي هذه السنة وجه ابراهيم بن
0630IbnAthirCizzDin.Kamil,0421Miskawayh.Tajarib,1786,698,739,1602,1786,699,777,270, فاخذ ثابت بن نعيم واولاده وحبسهم وضبط الجند حتي بلغ حران وسيرهم الي الشام ودعا اهل الجزيرة, فيولهم وسلبوا سلاحهم ووضعms0698 في ارجلهم السلاسل ووكل بهم عدة من حرسه يحتفظون بهم وشخص بجماعة الجند من اهل الشام والجزيرة وضمهم الي عسكره وضبطهم في مسيره فلم يقدر احد منهم علي ان يشذ ولا ان يظلم احدا من اهل القري ولا يرزاه شيءا الا بثمن حتي ورد حران ثم امرهم باللحاق باجنادهم وحبس ثابتا معه ودعا اهل الجزيرة الي الفرض ففرض لستة
0630IbnAthirCizzDin.Kamil,0421Miskawayh.Tajarib,1812,716,1556,1561,1813,717,141,859, فانهزموا وترجل تميم بن نصر فقاتلms1812 فلما هزمت اليمانية مضر ارسل الحرث الي نصران اليمانية يعيرونني بانهزامكم وانا كاف فاجعل حماة اصحابك بازاء الكرماني فاخذ عليه نصر العهود بذلك وقدم علي نصر عبد الملك بن سعد, بانهزامكم وانا كاف فاجعلms0716 حماة اصحابك بازاء الكرماني فبعث اليه نصر يزيد النحوي او خالدا يتوثق منه ان يفي بما بذله من الكف وانما كف الحارث عن قتال نصر لان عمر بن الفضل الازدي واهل بيته وعبد الجبار بن العدوي وخالد بن عبيد الله وعامة اصحابه كانوا نقموا علي الكرماني ما فعله اهل التبوشكان وذلك ان اسدا كان وجه اليهم فنزلوا اليه علي حكم اسد فبقر بطون جماعة والقاهم في نهر بلخ وقطع ايدي ثلاثماءة منهم وارجلهم وقتل ثلثا وصلب ثلثا وباع اثقالهم فيمن يزيد فنقموا علي الحارث معاونته الكرماني وقتاله نصرا فاقام نصر بمرو اربعة ايام ثم خرج الي نيسابور ومعه سلم بن احوز وسلم بن عبد الرحمن وقال نصر لنساءه ان الحارث سيخلفني فيكن ويحميكن فلما قرب من نيسابور ارسل اليه اهلها ما اقدمك وقد اظهرت العصبية وكان امرا قد اطفاه الله وكان عامل نصر علي نيسابور ضرار بن عيسي العامري فارسل اليهم نصر بن سيار سنانا الاعرابي ومسلم بن عبد الرحمن وسلم بن احوز فكلموهم حتي خرجوا وتلقوا نصرا بالمواكب والهدايا والجواري وقدم من مكة علي نصر عبد الحكم
