book1,book2,start_ms1,start_ms2,start1,start2,end_ms1,end_ms2,end1,end2,text1,text2
0630IbnAthirCizzDin.Kamil,0310Tabari.Tarikh,15,61,281,468,15,61,345,1186, سكنوا الارض وطردتهم الملاءكة واسره بعض الملاءكة فذهب به الي السماء وروي عن سعيد بن مسعود ذلك واولي الاقوال بالصواب ان يقال, ابوا ان يسجدوا لادم وقال اخرون بل السبب في ذلك انه كان من بقايا الجن الذين كانوا في الارض فسفكوا فيها الدماء وافسدوا فيها وعصوا ربهم فقاتلتهم الملاءكة ذكر من قال ذلك حدثنا ابن حميد قال حدثنا يحيي بن واضح قال حدثنا ابو سعيد اليحمدي اسماعيل بن ابراهيم قال حدثني سوار بن الجعد اليحمدي عن شهر بن حوشب قوله كان من الجن قال كان ابليس من الجن الذين طردتهم الملاءكة فاسره بعض الملاءكة فذهب به الي السماء حدثني علي بن الحسن قال حدثني ابو نصر احمد بن محمد الخلال قال حدثني سنيد بن داود قال حدثنا هشيم قال اخبرنا عبد الرحمن بن يحيي عن موسي بن نمير وعثمان بن سعيد بن كامل عن سعد ابن مسعود قال كانت الملاءكة تقاتل الجن فسبي ابليس وكان صغيرا وكان مع الملاءكة يتعبد معهم فلما امروا ان يسجدوا لادم سجدوا وابي ابليس فلذلك قال الله عز وجل الا ابليس كان من الجن قال ابو جعفر واولي الاقوال
0630IbnAthirCizzDin.Kamil,0310Tabari.Tarikh,15,61,550,1464,15,62,643,924, واجتهاده وجاءز ان يكون لكونه من الجن الغريب ومرة الهمداني بسكون الميم والدال المهملة نسبة الي همدان قبيلة كبيرة من اليمن ذكر خلق ادم عليه السلام ومن الاحاديث, اجتهاده كان في عبادة ربه وكثرة علمه وماms0061 كان اوتي من ملك السماء الدنيا والارض وخزن الجنان وجاءز ان يكون كان لغير ذلك من الامور ولا يدرك علم ذلك الا بخبر تقوم به الحجة ولا خبر في ذلك عندنا كذلك والاختلاف في امره علي ما حكينا ورويناه وقد قيل ان سبب هلاكه كان من اجل ان الارض كان فيها قبل ادم الجن فبعث الله ابليس قاضيا يقضي بينهم فلم يزل يقضي بينهم بالحق الف سنة حتي سمي حكما وسماه الله به واوحي اليه اسمه فعند ذلك دخله الكبر فتعظم وتكبر والقي بين الذين كان الله بعثه اليهم حكما الباس والعداوة والبغضاء فاقتتلوا عند ذلك في الارض الفي سنة فيما زعموا حتي ان خيولهم تخوض في دماءهم قالوا وذلك قول الله تبارك وتعالي افعيينا بالخلق الاول بل هم في لبس من خلق جديد وقول الملاءكة اتجعل فيها من يفسد فيها ويسفك الدماء فبعث الله تعالي عند ذلك نارا فاحرقتهم قالوا فلما راي ابليس ما نزل بقومه من العذاب عرج الي السماء فاقام عند الملاءكة يعبد الله في السماء مجتهدا لم يعبده شء من خلقه مثل عبادته فلم يزل مجتهدا في العبادة حتي خلق الله ادم فكان من امره ومعصيته ربه ما كان القول في خلق ادم ع وكان مما حدث في ايام
0630IbnAthirCizzDin.Kamil,0310Tabari.Tarikh,16,64,421,1424,16,65,608,154, قال ربنا تبارك وتعالي ولقد خلقنا الانسان من صلصال من حما مسنون واللازب الطين الملتزب بعضه ببعض اي ثم ترك حتي تغير وانتن وصار حما مسنونا يعني منتنا ثم صار صلصالا وهو الذي له صوت وانما سمي ادم لانه خلق من اديم الارض قال ابن عباس امر الله بتربة, صلصالا كما قال الله تعالي ولقدms0064 خلقنا الانسان من صلصال من حما مسنون وحدثنا ابن بشار قال حدثنا يحيي بن سعيد وعبد الرحمن بن مهدي قالا حدثنا سفيان عن الاعمش عن مسلم البطين عن سعيد بن جبير عن ابن عباس قال خلق ادم من
0630IbnAthirCizzDin.Kamil,0310Tabari.Tarikh,20,78,403,944,20,78,433,979, وقاسمهما اني لكما لمن الناصحين اي تكونا ملكين او تخلدا ان لم تكونا ملكين في نعمة الجنة قال, وقاسمهما اني لكما لمن الناصحين اي تكونان ملكين او تخلدان اي ان لم تكونا ملكين في نعمة الجنة فلا
0630IbnAthirCizzDin.Kamil,0310Tabari.Tarikh,21,84,1430,916,22,85,62,352, في ذلك من اهل العلم يقولms0021 انه نفخ فيه الروح اخر نهار يوم الجمعة قبل غروب الشمس وقد روي ابو صالح عن ابن عباس ان مكث, من اهل العلم فانه كان يقول ان ادم نفخ فيه الروح في اخر النهار من يوم الجمعة قبل غروب الشمس من ذلك اليوم ثم الاخبار عن رسول الله ص متظاهرة بان الله تبارك وتعالي اسكنه الجنة فيه وفيه اهبطه الي الارض فان كان ذلك صحيحا فمعلوم ان اخر ساعة من نهار يوم من ايام الاخرة ومن الايام التي اليوم الواحد منها مقداره الف سنة من سنيننا انما هي ساعة بعد مضي احدي عشرة ساعة وذلك ساعة من اثنتي عشرة ساعة وهي ثلاث وثمانون سنة واربعة اشهر من سنيننا فادم صلوات الله عليه اذ كان الامر كذلك انما خلق لمضي احدي عشرة ساعة من نهار يوم الجمعة من الايام التي اليوم الواحد منها الف سنة من سنينناms0084 فمكث جسدا ملقي لم ينفخ فيه الروح اربعين عاما من اعوامنا ثم نفخ فيه الروح فكان مكثه في السماء بعد ذلك ومقامه في الجنة الي ان اصاب الخطيءة واهبط الي الارض ثلاثا واربعين سنة من سنيننا واربعة اشهر وذلك ساعة من ساعات يوم من الايام الستة التي خلق الله تعالي فيها الخلق وقد حدثني الحارث بن محمد قال حدثنا محمد بن سعد قال حدثنا هشام بن محمد قال اخبرني ابي عن ابي صالح عن ابن عباس قال خرج
0630IbnAthirCizzDin.Kamil,0310Tabari.Tarikh,26,101,1543,438,27,101,20,530, احدهما ولم يتقبل من الاخر اليms0026 اخر القصة قال فلما قتله سقط في يده ولم يدر كيف, قربانا فتقبل من احدهما الي اخر القصة قال فلما قتله سقط في يديه ولم يدر كيف يواريه وذلك انه كان فيما يزعمون اول قتيل من بني ادم فبعث الله غرابا يبحث في
0630IbnAthirCizzDin.Kamil,0310Tabari.Tarikh,33,118,1481,697,34,118,33,998, وفاته وقد اتت عليه تسعماءةms0033 سنة واثنتا عشرة سنة ذكر عقب شيث وقام انوش بن شيث بعد موت ابيه, تسعماءة سنة واثنتا عشرة سنة وولد لشيث انوش بعد ان مضي من عمره ستماءه سنه وخمس سنين فيما يزعم اهل التوراة واما ابن اسحاق فانه قال فيما حدثنا ابن حميد قال حدثنا سلمة بن الفضل عنه نكح شيث بن ادم اخته حزورة ابنة ادم فولدت له يانش بن شيث ونعمة ابنة شيث وشيث يومءذ ابن ماءة سنة وخمس سنين فعاش بعد ما ولد له يانش ثمانماءه سنة وسبع سنين وقام انوش بعد مضي ابيه شيث
0630IbnAthirCizzDin.Kamil,0310Tabari.Tarikh,35,121,1156,745,35,122,1248,941, ذلك كان فيما بين ادم ونوح منهم ابن عباس او مثله ومثله روي الحكم بن عتيبة عن ابيه مع اختلاف قريب من القولين والله اعلم واما نسابو الفرس فقد ذكرت ما, ونوح ص ذكر من روي ذلك عنه حدثنا احمد بن زهير قال حدثنا موسي بن اسماعيل قال حدثنا داود يعني ابن ابي الفرات قال حدثنا علباء بن احمر عن عكرمة عن ابن عباس انه تلا هذه الاية ولا تبرجن تبرج الجاهلية الاولي قال كانت فيما بين نوح وادريس وكانت الف سنة وان بطنين من ولد ادم كان احدهما يسكن السهل والاخر يسكن الجبل وكان رجال الجبل صباحا وفي النساء دمامة وكان نساء السهل صباحا وفي الرجال دمامة وان ابليس اتي رجلا من اهل السهل في صورة غلام فاجر نفسه منه وكان يخدمه واتخذ ابليس لعنه الله شيءا مثل الذي يزمر فيه الرعاء فجاء فيه بصوت لم يسمع الناس مثله فبلغ ذلك من حولهم فانتابوهم يسمعون اليه واتخذوا عيدا يجتمعون اليه في السنة فتتبرج النساء للرجال قال وينزل الرجال لهن وان رجلا من اهل الجبل هجم عليهم وهم في عيدهم ذلك فراي النساء وصباحتهن فاتي اصحابه فاخبرهم بذلك فتحولوا اليهن فنزلوا عليهن فظهرت الفاحشة فيهن فهو قول الله عز وجل ولا تبرجن تبرج الجاهليةms0121 الاولي حدثنا ابن وكيع قال حدثنا ابن ابي غنية عن ابيه عن الحكم ولا تبرجن تبرج الجاهلية الاولي قال كان بين ادم ونوح ثمانماءه سنة وكان نساءهم اقبح ما يكون من النساء ورجالهم حسان فكانت المراة تريد الرجل علي نفسها فانزلت هذه الاية ولا تبرجن تبرج الجاهلية الاولي حدثني الحارث قال حدثنا ابن سعد قال اخبرني هشام قال اخبرني ابي عن ابي صالح عن ابن عباس قال لم يمت ادم حتي بلغ ولده وولد ولده اربعين الفا ببوذ وراي ادم فيهم الزنا وشرب الخمر والفساد فاوصي الا يناكح بنو شيث بني قابيل فجعل بنو شيث ادم في مغارة وجعلوا عليه حافظا لا يقربه احد من بني قابيل وكان الذين ياتونه ويستغفر لهم من بني شيث فقال ماءة من بني شيث صباح لو نظرنا الي ما فعل بنو عمنا يعنون بني قابيل فهبطت الماءة الي نساء صباح من بني قابيل فاحتبس النساء الرجال ثم مكثوا ما شاء الله ثم قال ماءة اخرون لو نظرنا ما فعل اخوتنا فهبطوا من الجبل اليهم فاحتبسهم النساء ثم هبط بنو شيث كلهم فجاءت المعصية وتناكحوا واختلطوا وكثر بنو قابيل حتي ملءوا الارض وهم الذين غرقوا ايام نوح مهلاءيل هو اوشهنج واما نسابو الفرس فقد ذكرت ما
0630IbnAthirCizzDin.Kamil,0310Tabari.Tarikh,37,125,1349,1555,38,126,142,75, الي ملة الصاءبين كذا قال ابو جعفر وغيره من العلماء انه ركب ابليس وطاف عليه والعهدة عليهم وانما نحن نقلنا ما قالوه قال ابن الكلبي اول ملوك الارض من بابل طهمورث وكان لله مطيعا وكان ملكه اربعين سنة وهو اول من كتب بالفارسية وفي ايامه عبدت الاصنام واولms0037 ما عرف الصوم في ملكه وسببه ان قوما فقراء تعذر عليهم القوت فامسكوا نهارا واكلوا ليلا ما يمسك رمقهم ثم اعتقدوه تقربا الي الله وجاءت الشراءع به ذكر خنوخ وهو ادريس عليه السلام, بالفارسيه وان بيوراسب ظهرms0125 في اول سنة من ملكه ودعا الي ملة الصابءين ذكر اخنوخ وهو ادريس ثم رجعنا الي ذكر اخنوخ وهو ادريس ع ثم نكح
0630IbnAthirCizzDin.Kamil,0310Tabari.Tarikh,39,128,1373,1048,40,128,29,1115, وصناع وطبقة حراثين واتخذ منهم خدما ووضع لكل امر خاتما مخصوصا به فكتب علي خاتم الحرب الرفق والمدارة وعلي خاتم الخراج العمارة والعدل وعلي خاتم البرد والرسل الصدق والامانة وعلي خاتم المظالم السياسة والانتصاف وبقيتms0039 رسوم تلك الخواتيم حتي محاها الاسلام ومن سنة ماءة وخمسين, كتابا وصناعا وحراثين واتخذ طبقة منهم خدما وامر كل طبقة من تلك الطبقات بلزوم العمل الذي الزمها اياه ومن سنة ماءة وخمسين الي
0630IbnAthirCizzDin.Kamil,0310Tabari.Tarikh,47,147,800,1319,47,148,874,123, خصصتنا باثقالك واسبابك من بينهم فاقر بالاساءة وتالف القوم ووعدهم بما يحبون وامرهم بالانصراف ليعودوا ويقضي حواءجهم ثم ينصرفوا الي, بمءنتك وتحاملك واساءتك من بين اهل الاقاليم وكيف لم تقسم امر كذا وكذا بيننا وبين الاقاليم وعدد عليه اشياء كان يمكنه تخفيفها عنهم وجرد له الصدق والقول في ذلك فقدح في قلب الضحاك قوله وعمل فيه حتي انخزل واقر بالاساءة وتالف القوم ووعدهم ما يحبون وامرهم بالانصراف لينزلوا ويتدعوا ثم يعودوا ليقضي حواءجهم ثم ينصرفوا اليms0147 بلادهم وزعموا ان امه ودك كانت شرا منه واردي وانها كانت في وقت معاتبة القوم اياه بالقرب منه تتعرف ما يقولونه فتغتاظ وتنكره فلما خرج القوم دخلت مستشيطة
0630IbnAthirCizzDin.Kamil,0310Tabari.Tarikh,50,158,1531,563,51,158,458,1173, ابراهيم الذي ذكره الله في كلامه العزيز وانماms0050 ذكرته في هذا الموضع لان قصته في اولاده الثلاثة شبيهة بقصة نوح علي ما سياتي ولحسن سيرته وهلاك الضحاك علي يديه ولانه قيل ان هلاك الضحاك كان علي يد نوح واما باقي نسابة الفرس فانهم ينسبون افريدون الي جمشيد الملك وكان بينهما عشرة اباء كلهم يسمي اثغيان خوفا من الضحاك وانما كانوا يتميزون بالقاب لقبوها فكان يقال لاحدهم اثغيان صاحب البقر احمر واثغيان صاحب البقر البلق واشباه ذلك وكان افريدون اول من ذلل الفيلة وامتطاها ونتج البغال واتخذ الاوز والحمام وعمل الترياق ورد المظالم وامر الناس بعبادة, السبع الذي ذكر الله في كتابه وقال بعضهم هو سليمان بن داود وانما ذكرته في هذا الموضع لما ذكرت فيه من قول من قال انه نوح وان قصته شبيهة بقصة نوح في اولاد له ثلاثة وعدله وحسن سيرته وهلاك الضحاك علي يده وانه قيل ان هلاك الضحاك كان علي يد نوح وان نوحا انما كان ارسل في قول من ذكرت عنه انه قال كان هلاك الضحاك علي يدي نوح حين ارسل الي قومه وهم كانوا قوم الضحاك فاما الفرس فانهم ينسبونه النسبة التي انا ذاكرها وذلك انهم يزعمون ان افريدون من ولد جم شاذ الملك الذي قتله الازدهاق علي ما قد بينا من امره قبل وان بينه وبين جم عشرة اباء وقد حدثت عن هشام بن محمد بن الساءب قال بلغنا ان افريدون وهو من نسل جم الملك الذي كان من قبل الضحاك قال ويزعمون انه التاسع من ولده وكان مولده بدنباوند
0630IbnAthirCizzDin.Kamil,0310Tabari.Tarikh,57,175,1552,1102,58,176,32,171, وذي القرنين وسليمان بن داود واضافms0057 غيره اليهم بختنصر وسنذرك بطلان هذا القول فلما اراد الله ان, وذي القرنين وسليمان بن داود وقال بعضهم نمرود هو الضحاك نفسه حدثت عن هشام بن محمد قال بلغنا والله اعلم ان الضحاك هو نمرود وان ابراهيم خليل الرحمن ولد في زمانه وانه صاحبه الذي اراد احراقه حدثني موسي بن هارون قال حدثنا عمرو بن حماد قال حدثنا اسباط عن السدي في خبر ذكره عن ابي صالح وعن ابي مالك عن ابن عباس وعن مرة الهمداني عن ابن مسعود وعن ناس من اصحاب النبي ص ان اول ملك ملك في الارض شرقها وغربها نمرود بن كنعان ابنms0175 كوش بن سام بن نوح وكانت الملوك الذين ملكوا الارض كلها اربعة نمرود وسليمان بن داود وذو القرنين وبختنصر مءمنان وكافران وقال ابن اسحاق فيما حدثني ابن حميد قال حدثنا سلمة عن ابن اسحاق فلما اراد الله عز
0630IbnAthirCizzDin.Kamil,0310Tabari.Tarikh,87,256,1074,527,87,256,1099,918, مثله اذا مات وسقط الي الارض وقيل جلس بين رجليها فراي في الحاءط ولا تقربوا الزني, حل الهميان وجلس منها مجلس الحاءز حدثنا الحسن بن محمد قال حدثنا حجاج بن محمد عن ابن جريج قال اخبرنا عبد الله بن ابي مليكة قال قلت لابن عباس ما بلغ من هم يوسف قال استلقت له وجلس بين رجليها ينزع ثيابه فصرف الله تعالي عنه ما كان هم به من السوء بما راي من البرهان الذي اراه الله فذلك فيما قال بعضهم صورة يعقوب عاضا علي اصبعه وقال بعضهم بل نودي من جانب البيت اتزني فتكون كالطير وقع ريشه فذهب يطير ولا ريش له وقال بعضهم راي في الحاءط مكتوبا ولا تقربوا
0630IbnAthirCizzDin.Kamil,0310Tabari.Tarikh,103,290,196,1515,103,291,480,777, سنة او سنتين الا وان الملك ينبغي ان يكون فيه ثلاث خصال ان يكون صديقا لا يكذب وان يكون سخيا لا يبخل وان يملك نفسه عند الغضب فانه مسلط ويده مبسوطة والخراج ياتيه فلا يستاثر علي جنده ورعيته بما هم اهل له وان يكثر العفو فانه لا ملك اقوي ولا ابقي من ملك فيه العفو فان الملك ان يخطء في العفو خير من ان يخطء في العقوبة الا وان الترك قد طمعت فيكم, او سنتين وامر الجند للملك بمنزلة جناحي الطاءر فهم اجنحة الملك متي قصms0290 من الجناح ريشة كان ذلك نقصانا منه فكذلك الملك انما هو بجناحه وريشه الا وان الملك ينبغي ان يكون فيه ثلاث خصال اولها ان يكون صدوقا لا يكذب وان يكون سخيا لا يبخل وان يملك نفسه عند الغضب فانه مسلط ويده مبسوطة والخراج ياتيه فينبغي الا يستاثر عن جنده ورعيته بما هم اهل له وان يكثر العفو فانه لا ملك ابقي من ملك فيه العفو ولا اهلك من ملك فيه العقوبة الا وان المرء ان يخطء في العفو فيعفو خير من ان يخطء في العقوبة فينبغي للملك ان يتثبت في الامر الذي فيه قتل النفس وبوارها واذا رفع اليه من عامل من عماله ما يستوجب به العقوبة فلا ينبغي له ان يحابيه وليجمع بينه وبين المتظلم فان صح عليه للمظلوم حق خرج اليه منه وان عجز عنه ادي عنه الملك ورده الي موضعه واخذه باصلاح ما افسد فهذا لكم علينا الا ومن سفك دما بغير حق او قطع يدا بغير حق فاني لا اعفو عن ذلك الا ان يعفو عنه صاحبه فخذوا هذا عني وان الترك قد طمعت فيكم فاكفونا
0630IbnAthirCizzDin.Kamil,0310Tabari.Tarikh,103,291,853,1370,103,292,868,938, يحلون عقد الرحال الا في غيرها وهي خطبة طويلة ثم امر بالطعام فاكلوا وشربوا, يحلون عقد الرحال الا في غيرها وانما بلغتهم فيها بالعواري فما احسن الشكر للمنعم والتسليم لمن القضاء له ومن احق بالتسليم لمن فوقه ممن لا يجد مهربا الا اليه ولاms0291 معولا الا عليه فثقوا بالغلبة اذا كانت نياتكم ان النصر من الله وكونوا علي ثقة من درك الطلبة اذا صحت نياتكم واعلموا ان هذا الملك لا يقوم الا بالاستقامة وحسن الطاعة وقمع العدو وسد الثغور والعدل للرعية وانصاف المظلوم فشفاءكم عندكم والدواء الذي لا داء فيه الاستقامة والامر بالخير والنهي عن الشر ولا قوه الا بالله انظروا للرعية فانها مطعمكم ومشربكم ومتي عدلتم فيها رغبوا في العمارة فزاد ذلك في خراجكم وتبين في زيادة ارزاقكم واذا خفتم علي الرعية زهدوا في العمارة وعطلوا اكثر الارض فنقص ذلك من خراجكم وتبين في نقص ارزاقكم فتعاهدوا الرعية بالانصاف وما كان من الانهار والبثوق مما نفقة ذلك من السلطان فاسرعوا فيه قبل ان يكثر وما كان من ذلك علي الرعية فعجزوا عنه فاقرضوهم من بيت مال الخراج فاذا حان اوقات خراجهم فخذوا من خراج غلاتهم علي قدر ما لا يجحف ذلك بهم ربع في كل سنة او ثلث او نصف لكيلا يشق ذلك عليهم هذا قولي وامري يا موبذ موبذان الزم هذا القول وخذ في هذا الذي سمعت في يومك اسمعتم ايها الناس فقالوا نعم قد قلت فاحسنت ونحن فاعلون ان شاء الله ثم امر بالطعام فوضع فاكلوا
