book1,book2,start_ms1,start_ms2,start1,start2,end_ms1,end_ms2,end1,end2,text1,text2
0630IbnAthirCizzDin.Kamil,0310Tabari.Tarikh,810,1606,510,268,810,1606,592,818, وليبرز الي ابو مريم وابو مريام فكفوا وخرجا اليه فدعاهما الي الاسلام او الجزية واخبرهما بوصية النبي باهل مصر بسبب هاجر ام اسماعيل عليه السلام, فليبرز الي ابو مريم وابو مريام فاجابوه الي ذلك وامن بعضهم بعضا فقال لهما عمرو انتما راهبا هذه البلدة فاسمعا ان الله عز وجل بعث محمدا ص بالحق وامره به وامرنا به محمد ص وادي الينا كل الذي امر به ثم مضي صلوات الله عليه ورحمته وقد قضي الذي عليه وتركنا علي الواضحة وكان مما امرنا به الاعذار الي الناس فنحن ندعوكم الي الاسلام فمن اجابنا اليه فمثلنا ومن لم يجبنا عرضنا عليه الجزية وبذلنا له المنعة وقد اعلمنا انا مفتتحوكم واوصانا بكم حفظا لرحمنا فيكم وان لكم ان اجبتمونا بذلك ذمة الي ذمة ومما عهد الينا اميرنا استوصوا بالقبطيين خيرا فان رسول الله ص اوصانا بالقبطين خيرا لان لهم رحما وذمة فقالوا قرابة بعيدة لا يصل مثلها
0630IbnAthirCizzDin.Kamil,0310Tabari.Tarikh,811,1608,638,796,811,1608,738,1065, بلدان العرب وبعث بالاخماس الي عمر بن الخطاب ومعها وفد فاخبروا عمر بن الخطاب بحالهم كله وبما قال ابو مريم فرد عمر عليهم سبي من لم يقاتلهم في تلك الايام الاربعة, البشير علي عمر بعد بالاخماس وبعث الوفود فسالهم عمر فما زالوا يخبرونه حتي مروا بحديث الجاثليق وصاحبه فقال الا اراهما يبصران وانتم تجاهلون ولا تبصرون من قاتلكم فلا امان له ومن لم يقاتلكم فاصابه منكم شء من اهل القري فله الامان في الايام الخمسة حتي تنصرم وبعث في الافاق حتي رد ذلك السبي الذي سبوا ممن لم يقاتل في الايام الخمسة الا
0630IbnAthirCizzDin.Kamil,0310Tabari.Tarikh,818,1624,224,1605,818,1625,237,94, بنهاوند كل من غاب عن القادسية ليسوا بدونهم فلما راهم النعمان كبر وكبر, من غاب عن القادسية والايامms1624 من اهل الثغور وامراءها واعلام من اعلامهم ليسوا بدون من شهد الايام والقوادس وعلي خيولهم انوشق فلما راهم النعمان كبر وكبر
0630IbnAthirCizzDin.Kamil,0310Tabari.Tarikh,830,1647,669,309,830,1647,723,994, الي عمر وبعثا بما خمسا ولما جمع عمر لعتبة عمل بكير كتب لاهل اذربيجان كتابا بالصلح وفيها قدم عتبة علي عمر بالخبيص, عتبة بفتح ما ولي وتم الصلح بعد ما هزم عتبة بهرام وكتب عتبة بينه وبين اهل اذربيجان كتابا حيث جمع له عمل بكير الي عمله بسم الله الرحمن الرحيم هذا ما اعطي عتبة بن فرقد عامل عمر بن الخطاب امير المءمنين اهل اذربيجان سهلها وجبلها وحواشيها وشفارها واهل مللها كلهم الامان علي انفسهم واموالهم ومللهم وشراءعهم علي ان يءدوا الجزية علي قدر طاقتهم ليس علي صبي ولا امراة ولا زمن ليس في يديه شء من الدنيا ولا متعبد متخل ليس في يديه من الدنيا شء لهم ذلك ولمن سكن معهم وعليهم قري المسلم من جنود المسلمين يوما وليلة ودلالته ومن حشر منهم في سنة وضع عنه جزاء تلك السنة ومن اقام فله مثل ما لمن اقام من ذلك ومن خرج فله الامان حتي يلجا الي حرزه وكتب جندب وشهد بكير بن عبد الله الليثي وسماك بن خرشة الانصاري وكتب في سنة ثمان عشرة قالوا وفيها قدم عتبة علي عمر بالخبيص
0630IbnAthirCizzDin.Kamil,0310Tabari.Tarikh,836,1661,1599,1413,837,1662,13,37, واخذوا الخزاءن واستولوا عليها وانهزم منهم ولحقms0836 بخاقان وعبر النهر من بلخ الي فرغانة واقام, وكتبوا الي الاحنف بالخبر فاعترضهم المسلمون والمشركون بمرو يثفنونه فقاتلوه واصابوه في اخر القوم واعجلوه عن الاثقال ومضي مواءلا حتي قطع النهر الي فرغانة والترك فلم يزل مقيما زمان عمر رضي الله عنه كله يكاتبهم ويكاتبونهms1661 او من شاء الله منهم فكفر اهل خراسان زمان عثمان واقبل اهل فارس علي
0630IbnAthirCizzDin.Kamil,0310Tabari.Tarikh,837,1663,1603,751,838,1663,148,807, بالمسالمة ولا تهيجهم ما لم يهيجوكms0837 فاقام يزدجرد بفرغانة ومعه ال كسري بعهد من خاقان ولما وصل خبر الفتح الي عمر بن الخطاب جمع الناس وخطبهم وقرا عليهم كتاب الفتح وحمد الله في خطبته علي انجاز وعده ثم قال الا وان ملك, يهيجوك واقام يزدجرد وال كسري بفرغانة معهم عهد من خاقان ولما وقع الرسول بالفتح والوفد بالخبر ومعهم الغناءم بعمر بن
0630IbnAthirCizzDin.Kamil,0310Tabari.Tarikh,838,1664,1569,1265,839,1665,849,1375, فقصد مجاشع بن مسعود لسابور واردشيرخرة فيمنms0838 معه فالتقي هو والفرس بتوج فاقتتلوا ما شاء الله ثم انهزم الفرس وقتلهم المسلمون كيف شاءوا كل قتلة وغنموا ما في عسكرهم وحصروا توج فافتتحوها وقتلوا منهم خلقا كثيرا وغنموا ما فيها وهذه توج الاخرة والاولي هي التي استقدمتها جنود العلاء بن الحضرمي ايام طاوس ثم دعوا الي الجزية فرجعوا واقروا بها وارسل مجاشع بن مسعود السلمي بالبشارة والاخماس الي عمر بن الخطاب ذكر فتح اصطخر وجور وغيرهما وقصد عثمان بن ابي العاص الثقفي لاصطخر فالتقي هو واهل اصطخر بجور فاقتتلوا وانهزم الفرس وفتح المسلمون جور ثم اصطخر وقتلوا ما شاء الله ثم فر منهم من فر فدعاهم عثمان الي الجزية والذمة فاجابه الهربذ اليها فتراجعوا وكان عثمان قد جمع الغناءم لما هزمهم فبعث بخمسها الي عمر وقسم الباقي في الناس وفتح عثمان كازرون والنوبندجان وغلب علي ارضها وفتح هو وابو موسي مدينة شيراز وارجان وفتحا سينيز علي الجزية والخراج وقصد عثمان ايضا جنابا ففتحها ولقيه جمع الفرس بناحية جهرم فهزمهم وفتحها ثم ان شهرك خلع في اخر خلافة, شاءوا وغنمهم ما في عسكرهم فحووه وهذه توج الاخرة ولم يكن لها بعدها شوكة والاولي التي تنقذ فيها جنود العلاء ايام طاوس الوقعة التي اقتتلوا فيها والوقعتان الاولي والاخرة كلتاهما متساجلتان ثم دعوا الي الجزية والذمة فراجعوا واقروا وخمس مجاشع الغناءم وبعث بها ووفد وفدا وقد كانت البشراء والوفود يجازون وتقضي لهم حواءجهم لسنة جرت بذلك من رسول الله ص كتب الي السريms1664 عن شعيب عن سيف عن محمد بن سوقة عن عاصم بن كليب عن ابيه قال خرجنا مع مجاشع بن مسعود غازين توج فحاصرناها وقاتلناهم ما شاء الله فلما افتتحناها وحوينا نهبها نهبا كثيرا وقتلنا قتلي عظيمة وكان علي قميص قد تخرق فاخذت ابرة وسلكا وجعلت اخيط قميصي بها ثم اني نظرت الي رجل في القتلي عليه قميص فنزعته فاتيت به الماء فجعلت اضربه بين حجرين حتي ذهب ما فيه فلبسته فلما جمعت الرثة قام مجاشع خطيبا فحمد الله واثني عليه فقال ايها الناس لا تغلوا فانه من غل جاء بما غل يوم القيامة ردوا ولو المخيط فلما سمعت ذلك نزعت القميص فالقيته في الاخماس فتح اصطخر قال وقصد عثمان بن ابي العاص لاصطخر فالتقي هو واهل اصطخر بجور فاقتتلوا ما شاء الله ثم ان الله عز وجل فتح لهم جور وفتح المسلمون اصطخر فقتلوا ما شاء الله واصابوا ما شاءوا وفر من فر ثم ان عثمان دعا الناس الي الجزاء والذمة فراسلوه وراسلهم فاجابه الهربذ وكل من هرب او تنحي فتراجعوا وباحوا بالجزاء وقد كان عثمان لما هزم القوم جمع اليه ما افاء الله عليهم فخمسه وبعث بالخمس الي عمر وقسم اربعة اخماس المغنم في الناس وعفت الجند عن النهاب وادوا الامانة واستدقوا الدنيا فجمعهم عثمان ثم قام فيهم وقال ان هذا الامر لا يزال مقبلا ولا يزال اهله معافين مما يكرهون ما لم يغلوا فاذا غلوا راوا ما ينكرون ولم يسد الكثير مسد القليل اليوم كتب الي السري عن شعيب عن سيف عن ابي سفيان عن الحسن قال قال عثمان بن ابي العاص يوم اصطخر ان الله اذا اراد بقوم خيرا كفهم ووفر امانتهم فاحفظوها فان اول ما تفقدون من دينكم الامانة فاذا فقدتموها جدد لكم في كل يوم فقدان شء من اموركم ثم ان شهرك خلع في اخر امارة
0630IbnAthirCizzDin.Kamil,0310Tabari.Tarikh,842,1669,314,1520,842,1670,332,42, ان يفعل فقيل انهما رستاقان فامتنع عمر من ذلك ذكر فتح سجستان وقصد عاصم بن, يفعل فقيل لعمر انهما رستاقانms1669 عظيمان فلم يقطعه اياهما وهما بابا خراسان ذكر فتح سجستان قالوا وقصد عاصم
0630IbnAthirCizzDin.Kamil,0310Tabari.Tarikh,853,1692,245,1451,853,1693,461,446, امير المءمنين وهو اول من كتب التاريخ وقد تقدم وهو اول من اتخذ بيت مال واول من عس الليل واول من عاقب علي الهجاء واول من نهي عن بيع امهات الاولاد واول من جمع الناس في صلاة الجنازة علي اربع تكبيرات وكانوا قبل ذلك يصلون اربعا وخمسا وستا قال الواقدي وهو اول من جمع الناس علي امام, المءمنين قال احمد بن عبد الصمد سالتها كم اتيms1692 عليك من السنين قالت ماءة وثلاث وثلاثون سنة حدثنا ابن حميد قال حدثنا يحيي بن واضح قال حدثنا ابو حمزة عن جابر قال قال رجل لعمر بن الخطاب يا خليفة الله قال خالف الله بك فقال جعلني الله فداءك قال اذا يهينك الله وضعه التاريخ قال ابو جعفر وكان اول من وضع التاريخ وكتبه فيما حدثني الحارث قال حدثنا ابن سعد عن محمد بن عمر في سنة ست عشرة في شهر ربيع الاول منها وقد مضي ذكري سبب كتابه ذلك وكيف كان الامر فيه وعمر رضي الله عنه اول من ارخ الكتب وختم بالطين وهو اول من جمع الناس علي امام
0630IbnAthirCizzDin.Kamil,0310Tabari.Tarikh,855,1703,1034,1040,855,1703,1067,1073, بني انه عمر وانما يعمل لله وقد اتاك ابوك فخشيت ان تخرج اليه من كل شء واهل ذلك هو ولا يعلم, بني انه عمر وانما يعمل لله وقد اتاك ابوك فخشيت ان تخرج اليه من كل شء واهل ذلك هو فلا يعلم
0630IbnAthirCizzDin.Kamil,0310Tabari.Tarikh,862,1714,434,1470,862,1715,1010,499, ايها الرهط علي انفسكم سبيلا ودعا عليا وقال عليك عهد الله وميثاقه لتعملن بكتاب الله وسنة رسوله وسيرة الخليفتين من بعده قال ارجو ان افعل فاعمل بمبلغ علمي وطاقتي ودعا عثمان فقال له مثل ما قال لعلي فقال نعم نعمل فرفع راسه الي سقف المسجد ويده في يد عثمان فقال اللهم اسمع واشهد اني جعلت ما في رقبتي من ذلك في رقبة عثمان فبايعه فقال علي ليس هذا اول يوم تظاهرتم فيه علينا فصبر جميل والله المستعان علي ما تصفون والله ما وليت عثمان الا ليرد الامر اليك والله كل يوم في شان فقال عبد الرحمن يا علي لا تجعل علي نفسك حجة وسبيلا فخرج علي وهو يقول سيبلغ الكتاب اجله فقال المقداد يا عبد الرحمن اما والله لقد تركته وانه من الذين يقضون بالحق وبع يعدلون, علي انفسكم سبيلا ودعا عليا فقال عليك عهدms1714 الله وميثاقه لتعملن بكتاب الله وسنة رسوله وسيرة الخليفتين من بعده قال ارجو ان افعل واعمل بمبلغ علمي وطاقتي ودعا عثمان فقال له مثل ما قال لعلي قال نعم فبايعه فقال علي حبوته حبو دهر ليس هذا اول يوم تظاهرتم فيه علينا فصبر جميل والله المستعان علي ما تصفون والله ما وليت عثمان الا ليرد الامر اليك والله كل يوم هو في شان فقال عبد الرحمن يا علي لا تجعل علي نفسك سبيلا فاني قد نظرت وشاورت الناس فاذا هم لا يعدلون بعثمان فخرج علي وهو يقول سيبلغ الكتاب اجله فقال المقداد يا عبد الرحمن اما والله لقد تركته من الذين يقضون بالحق وبه يعدلون
0630IbnAthirCizzDin.Kamil,0310Tabari.Tarikh,877,1732,154,1539,877,1733,389,338, لا فطال عليهم المقام ونفدت نفقاتهم فكتبوا اسماءهم ودفعوها الي وزراءه وقالوا ان سال عنا امير المءمنين فاخبروه ثم رجعوا الي افريقية فخرجوا علي عامل هشام فقتلوه واستولوا علي افريقية وبلغ الخبر هشاما فسال عن النفر فرفعت اليه فعرف اسماءهم فاذا هم الذين صنعوا ذلك ذكر غزوة الاندلس لما افتتحت افريقية, نفعل فلما طال عليهم ونفدتms1732 نفقاتهم كتبوا اسماءهم في رقاع ورفعوها الي الوزراء وقالوا هذه اسماءنا وانسابنا فان سالكم امير المءمنين عنا فاخبروه ثم كان وجههم الي افريقية فخرجوا علي عامل هشام فقتلوه واستولوا علي افريقية وبلغ هشاما الخبر وسال عن النفر فرفعت اليه اسماءهم فاذا هم الذين جاء الخبر انهم صنعوا ما صنعوا وكتب الي السري عن شعيب عن سيف عن محمد وطلحة قالا وارسل عثمان عبد الله بن نافع بن الحصين
0630IbnAthirCizzDin.Kamil,0310Tabari.Tarikh,878,1736,1359,1513,879,1737,42,309, فتتقيك وقال اخرون قد كنا نهدي لنستثيب فقال عمر لكن الرسول رسول المسلمين والبريد بريدهم والمسلمون عظموها في صدرها فامر بردها الي بيت المال واعطاها بقدر نفقتها فلما كان زمن عثمان كتب اليهms0878 معاوية يستاذنه في غزو البحر مرارا فاجابه عثمان باخرة الي ذلك وقال له, فتتقيك وقال اخرون قد كناms1736 نهدي الثياب لنستثيب ونبعث بها لتباع ولنصيب ثمنا فقال ولكن الرسول رسول المسلمين والبريد بريدهم والمسلمون عظموها في صدرها فامر بردها الي بيت المال ورد عليها بقدر نفقتها كتب الي السري عن شعيب عن سيف عن ابي حارثة عن خالد بن معدان قال اول من غزا في البحر معاوية بن ابي سفيان زمان عثمان بن عفان وقد كان استاذن عمر فيه فلم ياذن له فلما ولي عثمان
0630IbnAthirCizzDin.Kamil,0310Tabari.Tarikh,882,1741,886,335,882,1741,1154,1191, هبيرة السلمي علي نيسابور وبه تخرج عبد الله بن خازم وهو ابن عمه ثم جمعها عثمان قبل موته لقيس واستعمل امير بن احمر علي سجستان ثم جعل عليها عبد الرحمن بن سمرة وهو من ال حبيب بن عبد شمس فمات عثمان وهو عليها ومات وعمران علي مكران وعمير بن عثمان بن سعد علي فارس وابن كندير القشيري علي كرمان ثم اوفد قيس بن هبيرة عبد الله بن خازم, الهيثم السلمي علي نيسابور وهو اول من خرج وعبد الله بن خازم وهو ابن عمه ثم ان عثمان جمعها له قبل موته فمات وقيس علي خراسان واستعمل امين بن احمر علي سجستان ثم جعل عليها عبد الرحمن بن سمرة وهو من ال حبيب ابن عبد شمس فمات عثمان وهو عليها ومات وعمران علي كرمان وعمير ابن عثمان بن سعد علي فارس وابن كندير القشيري علي مكران وقال علي بن محمد اخبرنا علي بن مجاهد عن اشياخه قال قال غيلان بن خرشة لعثمان بن عفان اما منكم خسيس فترفعوه اما منكم فقير فتجيروه يا معشر قريش حتي متي ياكل هذا الشيخ الاشعري هذه البلاد فانتبه لها الشيخ فولاها عبد الله بن عامر قال علي بن محمد اخبرنا ابو بكر الهذلي قال ولي عثمان ابن عامر البصرة فقال الحسن قال ابو موسي ياتيكم غلام خراج ولاج كريم الجدات والخالات والعمات يجمع له الجندان قال قال الحسن فقدم ابن عامر فجمع له جند ابي موسي وجند عثمان بن ابي العاص الثقفي وكان عثمان بن ابي العاص فيمن عبر من عمان والبحرين كتب الي السري عن شعيب عن سيف عن محمد وطلحة قالا وفد قيس بن هيثم عبد الله بن خازم
0630IbnAthirCizzDin.Kamil,0310Tabari.Tarikh,887,1753,1225,1088,887,1753,1402,1350, والروادف وجعل القراء في سمره فكانما كانت الكوفة يبسا شملته نار فانقطع الي ذلك الضرب ضربهم ففشت القالة في اهل الكوفة فكتب سعيد الي عثمان بذلك فجمع الناس واخبرهم بما كتب اليه فقالوا له اصبت فلا تسعفهم في ذلك ولا تطمعهم فيما ليسوا له باهل, بالقراء والمتسمتين في سمره فكانما كانت الكوفة يبسا شملته نار فانقطع الي ذلك الضرب ضربهم وفشت القالة والاذاعة فكتب سعيد الي عثمان بذلك فنادي منادي عثمان الصلاة جامعة فاجتمعوا فاخبرهم بالذي كتب به الي سعيد وبالذي كتب به اليه فيهم وبالذي جاءه من القالة والاذاعة فقالوا اصبت فلا تسعفهم في ذلك ولا تطعمهم فيما ليسوا له باهل
