book1,book2,start_ms1,start_ms2,start1,start2,end_ms1,end_ms2,end1,end2,text1,text2
0630IbnAthirCizzDin.Kamil,0334Azdi.TarikhMawsil,2662,643,1024,828,2663,644,421,417, يضيق بعساكرهم فضاء المغرب ذكر عدة حوادث فيها غزا بشر الخادم والي طرسوس بلاد الروم ففتح فيها وغنم وسبي واسر ماءة وخمسين بطريقا وكان السبي نحوا من الفي راس وفيها اوقع مءنس الخادم بناحية وادي الذءاب بمن هنالك من الاعراب من بني شيبان فقتل منهم خلقا كثيرا ونهب بيوتهم فاصاب فيها من اموال التجار التي كانوا اخذوها بقطع الطريق ما لا يحصي وفيها في ذي الحجة ماتت بدعة المغنية مولاة غريب مولي المامون وفيها في ذي الحجة خرجت الاعراب من الحاجز علي الحجاج فقطعوا عليها الطريق واخذوا من العين وما معهم من الامتعة والجمال ما ارادوا واخذوا ماءتين وخمسين امراة وحج بالناس هذه السنة الفضل بن عبد الملك وفيها قلد ابو الهيجاء عبد الله بن حمدان الموصل وفيها مات الشاهms2662 بن ميكال وفيها في ليلة الاضحي انقض ثلاثة كواكب كبار اثنان اول الليل وواحد اخره سوي كواكب صغار كثيرة والي اخر هذه السنة انتهي تاريخ ابي جعفر الطبري رحمه الله ورايت في بعض النسخ الي اخر سنة ثلاث وثلاثماءة وقيل ان سنة ثلاث زيادة فيه وليست من تاريخ الطبري والله اعلم وفيها توفي اسحاق بن ابي حسان الانماطي وابراهيم بن شريك وابو عيسي بن القزاز وابو العباس البراني وعلي بن محمد بن نصر بن بسام الشاعر وله نيف وسبعون سنة ثم دخلت سنة ثلاث وثلاثماءة ذكر امر, يضيق بعساكرهم فضاء المغرب وخرج علي الحاج رجل علوي ومعه بنو صالح بن مدرك الطاءي فقطعوا عليهم الطريق وتلف خلق كثير من الحاج بالقتل والعطش وخرج اعراب علي الحاج المنصرفين من مكة فاخذوا ما معهم من العين والامتعة واستاقوا من جمالهم ما ارادوا واخذوا من النساء ماءتين وثمانين امراة حراءر سوي المماليك وكان الذي حج بهم الفضل بن عبد الملك وفيها قلد ابو الهيجاء عبد الله بن حمدان الموصل وتوفي في هذه السنة من الاعيان احمد بن يونس بن عبد الاعلي بن موسي الصدفي يكني ابا الحسن ولد في ذي القعدة سنة اربعين وماثتين وكان من البكاءين حدث عن ابيه وغيره اسحاق بن ابراهيم بن ابي حسان ابو يعقوب الانماطي سمع احمد بن ابي الحواري وغيره روي عنه ابو عمرو بن السماك واسماعيل الخطبي وابن مقسم وقال الدارقطتي هو ثقة حمزة بن محمد بن عيسي بن حمزة ابو علي الكاتب جرجاني الاصل سمع من تعيم بن حماد روي عنه الجعابي وكان ثقة الحسن بن علي بنms643 موسي بن هارون ابو علي النحاس النيسابوري حدث وكان ثقة صالحا عبد الله بن الصقر بن نصر بن موسي بن هلال ابو العباس السكري سمع ابراهيم بن المنذر الحزامي وروي عنه جعفر الخلدي وابن مالك القطيعي وكان صدوفا ثقة عبد الله بن محمد بن ياسين ابو الحسن الفقيه الدوري سمع من بندار وروي عنه ابو بكر الشافعي وكان ثقة موسي بن القاسم بن ابراهيم ابو الحسن العلوي كتب الحديث وسمع الكثير ويتب عنه وكان رجلا صالخا متواضقا يلزم الجامع ودخلت سنة ثلاث وثلاثماءة ذكر امر
0630IbnAthirCizzDin.Kamil,0334Azdi.TarikhMawsil,2675,652,609,196,2675,652,1175,1255, ابو احمد بن حماد الموصلي وفيها دخل جني الصفواني بلاد الروم فنهب وخرب واحرق وفتح وعاد فقرءت الكتب علي المنابر ببغداد بذلك وفيها وقعت فتنة ببغداد بين العامة والحنابلة فاخذ الخليفة جماعة منهم وسيرهم الي البصرة فحبسوا وفيها امر المقتدر ببناء بيمارستان فبني واجري عليه النفقات الكثيرة وكان يسمي البيمارستان المقتدري وفيها توفي القاضي محمد بن خلف بن حيان ابو بكر الضبي المعروف بوكيع وكان عالما باخبار الناس وغيرها وله تصانيف حسنة والقاضي ابو العباس احمد بن عمر بن سريج الفقيه الشافعي وله سبع وخمسون سنة وفيها مات كنيز المغني وهو مشهور بالحذق في الغناء كنيز بضم الكاف وفتح النون واخرها زاي ثم دخلت سنة سبع وثلاثماءة في هذه السنة, ابو احمد بن حماد الموصلي وحج بالناس في هذه السنة الفضل بن عبد الملك وتوفي في هذه السنة من الاعيان احمد بن عمر بن سريج ابو العباس القاضي حدث عن الحسن بن محمد الزعفراني وعلي بن اشكاب وعباس الدوري وابي داود وغيرهم رري عنه سليمان ابن احمد الطبراني وابو احمد الغطريفي وانتهت اليه رياسة اصحاب الشافعي وشرح المذهب ولخصه وعمل المساءل في الفروع ابراهيم بن علي بن ابراهيم بن محمد ابو اسحاق العمري الموصلي قدم بغداد وحدث بها عن جماعة وروي عنه ابن صاعد والنجاد والخلدي وكان ثقة محمد بن خلف بن حيان بن صدقة بن زياد ابو بكر الضبي القاضي المعروف بوكيع كان عالما فاضلا عارفا بايام الناس فقيها قارءا نحوءا وكان يتقلد القضاء بالاهواز وله مصنفات منها كتاب العدد وسءل ابن مجاهد ان يصنف كتابا في العدد فقال قد كفانا ذاك وكيع حدث عن الزبير بن بكار والحسن بن عرفة وخلق كثير روي عنه احمد بن كامل القاضي وابو علي بن الصواف وابن المظفر وغيرهم منصور بن اسماعبلي بن عمر ابو الحسن الفقيه كان اديبا فهما عاقلا حاد العناظمة وصنف المختصرات في الفقه علي مذهب الشافعي وله الشعر المليح سكن الرملة ثم قدم مصر وقيل انه كان جنديا ثم انه كف بصره ويظهر في شغره التشيع ابو نصر المحب من مشايخ الصوفية كان له مروءة وسخاء ودخلت سنة سبع وثلاتماءه في هذه السنة
0630IbnAthirCizzDin.Kamil,0334Azdi.TarikhMawsil,2682,656,1152,771,2682,656,1357,976, اختلفوا فيه اختلافهم في المسيح عليه السلام فمن قاءل انه حل فيه جزء الهي ويدعي فيه الربوبية ومن قاءل انه ولي الله تعالي وان الذي يظهر منه من جملة كرامات الصالحين ومن قاءل انه مشعبذ وممخرق وساحر كذاب ومتكهن والجن تطيعه فتاتيه باليهكهة في غير اوانها وكان قدم من خراسان, اختلفوا فيه اختلافهم في المسيح عليه السلام فين قاءل انه حل فيه جزء الهي ويدعي فيه الربوبية ومن قاءل انه ولي الله تعالي وان الذي يظهر منه من جملة كرامات الصالحين ومن قاءل انه مشعبذ وممخرق وساحر كذاب ومتكهن والجن تطيعه فتاتيه بالفاكهة في غير اوانها وكان قدم من خراسان
0630IbnAthirCizzDin.Kamil,0334Azdi.TarikhMawsil,2711,668,1333,670,2711,668,1486,1265, الخرسي ببغداد وفيها توفي ابو بكر محمد بن السري المعروف بابن السراج النحوي صاحب كتاب الاصول في النحو وقيل توفي سنة ست عشرة وفيها في شعبان توفي ابو الحسن علي بن سليمان الاخفش فجاة ثم دخلت سنة ست عشرة وثلاثماءة, ومربعة الخرسي بغداد وتوفي في هذه السنة من الاعيان اسحاق بن احمد بن جعفر ابو يعقوب الكاغدي وايوب بن يوسف بن ايوب بن سليمان ابو القاسم البزاز المصري وبدر الشرابي والحسن بن محمد بن الحسن بن صالح بن شيخ بن عميرة ابو الحسين الاسدي والحسين بن محمد بن محمد بن عفير بن محمد بن سهل بن ابي حثمة ابو عبد الله الانصاري والحسين بن عبد الله بن الجصاص الجوهري ابو عبد الله وسليمان بن داود ابن كثير بن وفدان ابو محمد الطوسي وعبد الله بن احمد بن سعد ابو القاسم الجصاص وعلي بن سليمان بن الفضل ابو الحسين الاخفش ومحمد بن جعفر بن احمد بن عمر بن شبيب ابو الحسن الصيرفي يعرف بابن الكوفي ومحمد بن الحسين بن حفص ابو جعفر الخثعمي الاشناني الكوفي ثم دخلت سنة ست عشرة وثلاثماءة
0630IbnAthirCizzDin.Kamil,0334Azdi.TarikhMawsil,2731,674,485,544,2731,674,647,706, علي فاءدة فعادوا وفيها قلد القاضي ابو عمر محمد بن يوسف بن اسحاق بن حماد بن زيد قضاء القضاة وفيها قلد ابنا راءق شرطة بغداد مكان نازوك وفيها مات احمد بن منيع وكان مولده سنة اربع عشرة وماءتين وفيها اقر المقتدر بالله ناصر, علي فاندة فعادوا وفيها قلد القاضي ابو عمر محمد بن يوسف بن اسحاق بن حماد بن زيد قضاء القضاة وفيها قلد ابنا راءق شرطة بغداد مكان نازوك وفيها مات احمد بن منيع وكان مولده سنة اربع عشرة وماءتين وفيها اقر المقتدر بالله ناصر
0630IbnAthirCizzDin.Kamil,0334Azdi.TarikhMawsil,2731,674,917,1297,2731,674,1398,1458, بن حمدان في المحرم من سنة ثمان عشرة وثلاثماءة وفيها سار حاج العراق الي مكة علي طريق الشام فوصلوا الي الموصل اول شهر رمضان ثم منها الي الشام لانقطاع الطريق بسبب القرمطي معه كسوة الكعبة مع ابن عبدوس الجهشياري لانه كان من اصحاب الوزير وفيها في شعبان ظهر بالموصل خارجي يعرف بابن مطر وقصد نصيبين فسار اليه ناصر الدولة بن حمدان فقاتله فاسره وظهره فيه ايضا خارجي اسمه محمد بن صالح بالبوازيج فسار اليه ابو السرايا نصر بن حمدان فاخذه ايضا وفيها التقي مفلح الساجي والدمستق فاقتتلوا فانهزم الدمستق ودخل مفلح وراءه الي بلاد الروم وفيها اخر ذي القعدة, حمدان فقاتله فاسره وظهر فيها ايضا خارجي اسمه محمد بن صالح بالبوازيج فسار اليه ابو السرايا نصر بن حمدان فاخذه ايضا وفيها التقي مفلح الساجي والدمستق فاقتتلا فانهزم الدمستق ودخل مفلح وراءه الي بلاد الروم وفيها اخر ذي القعدة
0630IbnAthirCizzDin.Kamil,0334Azdi.TarikhMawsil,2731,674,1574,1630,2732,675,55,696, والدروب يشبه رمل طريق مكة وفيها توفي ابو بكر احمد بن الحسن بن الفرج بنms2731 سقير النحوي وكان عالما بمذهب الكوفيين وله فيها تصانيف ثم دخلت سنة ثمان عشرة وثلاثماءة, البيوت والدروب يشبه رمل طريقms674 مكة وحج بالناس في هذه انسنة متصور الديلمي وتوفي في هذه السنة من الاعيان احمد بن محمد بن احمد بن حفص ابو عمرو الجبري واحمد بن مهدي بن رستم واسماعيل بن اسحاق بن ابراهيم مولي بكر بن مضر بن النعمان يكني ابا احمد وبدر بن الهيثم بن خلف بن خالد بن راشد بن الضحاك ابن النعمان ابو القاسم اللخمي القاضي الكوفي وجعفر بن عبد الله بن جعفر بن مجاشع ابو محمد الختلي وجعفر بن محمد بن ابراهيم بن حبيب ابو بكر الصيدلاني وعبد الله ابن محمد بن عبد العزيز بن المرزبان بن سابور بن شاهنشاه ابو القاسم ابن بنت احمد بن منيع وعلي بن الحسن بن المغيرة ابو محمد الدقاق ومحمد بن الحسين بن محمد بن عمار ابو الفضل المعروف بابن ابي سعد الهروي ومحمد بن زبان بن حبيب ابو بكر الحضرمي وابو بكر احمد بن الحسن بن الفرج بن سقير النحوي لم دخلت سنة ثماني عشرة وثلاثماءة
0630IbnAthirCizzDin.Kamil,0334Azdi.TarikhMawsil,2743,680,741,1335,2743,681,763,1210, المقتدر الي ان افسد حاله ذكر عزل الحسين عن الوزراة وفيها عزل الحسين بن القاسم, المقتدر الي ان افسد حاله ذكر استيلاء مءنس علي الموصل قد ذكرنا مسير مءنس الي الموصل فلما سمع الحسين الوزير بمسيره كتب الي سعيد وداود ابني حمدان والي ابن اخيهما ناصر الدولة الحسن بن عبد الله بن حمدان يامرهم بمحاربة مءنس وصده عن الموصل وكان مءنس كتب في طريقه الي رءساء العرب يستدعيهم ويبذل لهم الاموال والخلعms680 ويقول لهم ان الخليفة قد ولاه المرصل وديار ربيعة واجتمع ينو حمدان علي محاربة مءنس الا داود ين حمدان فانه امتنع من ذلك لاحسان مءنس اليه فانه كان قد اخذه بعد ابيه ورباه في حجره واحسن اليه احسانا عظيما فلما امتنع من محاربته لم يزل به اخوته حتي وافقهم علي ذلك وذكروا له اساءة الحسين وابي الهيجاء ابني حمدان الي المقتدر مرة بعد مرة وانهم يريدون ان يغسلوا تلك السيءة ولما اجابهم قال لهم والله انكم لتخملونني علي البغي وكفران الاحسان وما امن ان يجيثني سهم غاءر فيقع في نحري فيقتلني فلما التقوا اتاه سهم كما وصف فقتله وكان مءنس اذا قيل له ان داود عازم علي قتالك ينكره ويقول كيف يقاتلني وقد اخذته طفلا وربيته في حجري ولما قرب مءنس من الموصل كان في ثمانماءة فارس واجتمع بنو حمدان في ثلاثين الفا والتقوا واقتتلوا فانهزم بنو حمدان ولم يقتل منهم غير داود وكان يلقب بالمجفجف وفيه يقول بعض الشعراء وقد هجا اميرا لو ثحنت في الف الفي ثلهم بطل مفل المجفجف داءد بن خفدان وتخيك الريح تجري حيث تامرها وفي يهينك سيف غير خوان لحنت اول فرا الي عدن تحرك سيف من خراسان وكان داود هذا من اشجع الناس ودخل مءنس الموصل ثالث صفر واستولي علي اموال بني حمدان وديارهم فخرج اليه كثير من العساكر من بغداد والشام ومصر من اصناف الناس لاحسانه الذي كان اليهم وعاد اليه ناصر الدولة بن حمدان فصار معه واقام بالموصل تسعة اشهر وعزم علي الانحدار الي بغداد وفيها عزل الحسين بن القاسم
0630IbnAthirCizzDin.Kamil,0334Azdi.TarikhMawsil,2786,698,860,930,2786,698,903,973, ابن مقلة بالمسير الي الموصل فسار اليها في العساكر في شعبان فلما قاربها رحل عنها ناصر الدولة بن حمدان, ابن مقلة بالمسير الي الموصل فسار اليها في العساكر في شعبان فلما قاربها رحل عنها ناصر الدولة بن حمدان
0630IbnAthirCizzDin.Kamil,0334Azdi.TarikhMawsil,2795,702,287,485,2795,702,308,532, ليس للخليفة حكم واما باقي الاطراف فكانت البصرة في يد ابن راءق وخوزستان في, والحكم في جميعها لابن راءق ليس للخليفة حكم واما باقي الاطراف فكانت البصرة في يد ابن راءق وخوزستان في
0630IbnAthirCizzDin.Kamil,0334Azdi.TarikhMawsil,2832,721,369,368,2832,721,418,417, مقاتل واستولي ابن طياب عليها فلما قارب المتقي لله وناصر الدولة بن حمدان بغداد هرب ابو الحسين منها الي واسط, مقاتل واستولي ابن طياب عليها فلما قارب المتقي لله وناصر الدولة بن حمدان بغداد هرب ابو الحسين منها الي واسط
0630IbnAthirCizzDin.Kamil,0334Azdi.TarikhMawsil,2873,732,1397,223,2874,732,1073,719, ابو القاسم الفضل بن المقتدر لانه كان بينهما منازعة وكان كا منهما يطلب الخلافة وهو يسعي فيها فلما ولي المستكفي خافه واستتر منه فطلبه المستكفي اشد الطلب فلم يظفر به فلما قدم معز الدولة بغداد قيل ان المطيع انتقل اليه واستتر عنده واغراه بالمستكفي حتي قبض عليه وسمله فلماms2873 قبض المستكفي بويع للمطيع لله بالخلافة يوم الخميس ثاني عشر جمادي الاخرة ولقب المطيع لله واحضر المستكفي عنده فسلم عليه بالخلافة واشهد علي نفسه بالخلع وازداد امر الخلافة ادبارهم ولم يبق لهم من الامر شء البتة وقد كانوا يراجعون ويءخذ امرهم فيما يفعل والحرمة قاءمة بعض الشء قلما كان ايام معز الدولة زال ذلك جميعه بحيث ان الخليفة لم يبق له وزير وانما كان له كاتب يدبر اقطاعه واخراجاته لا غير وصارت الوزارة لمعز الدولة يستوزر لنفسه من يريد وكان من اعظم الاسباب في ذلك ان الديلم يتشيعون ويغالون في التشيع ويعتقدون ان العباسيين قد غصبوا الخلافة واخذوها من مستحقيها فلم يكن عندهم باعث ديني يحثهم علي الطاعة حتي لقد بلغني ان معز الدولة استشار جماعة من خواص اصحابه في اخراج الخلافة من العباسيين والبيعة للمعز لدين الله العلوي او لغيره من العلويين فكلهم اشار عليه بذلك ما عدا بعض خواصه فانه قال ليس هذا براي فانك اليوم مع خليفة تعتقد انت واصحابك انك ليس من اهل الخلافة ولو امرتهم بقتله لقتلوه مستحلين دمه ومتي اجلست بعض العلوين خليفة كان معك من تعتقد انت واصحابك صحة خلافته فلوا امرهم بقتلك لفعلوه فاعرض عن ذلك فهذا كان من اعظم الاسباب في زوال امرهم ونهبهم مع حب الدنيا وطلب التفرد بها وتسلم معز الدولة العراق باسره, ابا القاسم الفضل بن المقتدر وبايعوه بالخلافة ولقبوه المطيع لله وسيه يومءذ اربع وثلاثون سنة ثم قدموا ابن عمه المستكفي فسلم عليه بالخلافة واشهد علي نفسه بالخلع قبل ان يسمل ثم صادر المطيع خواص المستكفي واخذ منهم اموالا كثيرة ووصل العباسيين والعلويين في يوم مع اضاقته بنيفب وثلاثين الف دينار وقرر له معز الدولة كل يوم ماءة دينار ليس الا تفقة وعظم الغلاء ببغداد في شعبان واكلوا الجيف والروث وماتوا علي الطرق واكلت الكلاب لحومهم وبيع العقار بالراغفان ووجدت الصغار مشوية مع المساكين وهرب الناس الي البصرة وواسط فمات خلق في الطرقات ذكر الحرب بين ناصر الدولة ومعز
